overall,vote,reviewTime,reviewerID,asin,reviewText,summary,negative,neutral,positive,compound
5.0,,2015-01-19,A17VBE138ECW73,B00000DMF5,"c'mon, are you kidding? what kid doesn't love candyland? it's a classic.",What kid doesn't love Candyland? It's a classic,0.264,0.637,0.099,-0.5152
4.0,,2015-01-02,A254EFLV4R4WPI,B00000DMC6,the only reason these don't get 5 is because of the packaging! the box they came in completely horrible fell apart as opening and the heavy duty plastic piece that slides in ontop was broken and sharp and glass upon arrival. otherwise they r awesome!!!,Awesome block! Horrible storage container/ packaging,0.155,0.767,0.079,-0.6074
4.0,,2015-01-08,A2Y18XMJ8GWER7,B00000DMF5,i miss the old board :( a lot going on on this one. hard for little kids (age: 3-4) to see which way the path goes.,I miss the old board: ( a lot going ...,0.219,0.781,0.0,-0.5994
1.0,14,2014-10-16,A2ZE67S39ITTO8,B00000DMC6,"the reason for giving one star is because the manufacture is misleading the customer's with wrong description. as per the description, ""the big blocks abc alphabet blocks are painted with letters, numbers and objects"". well that's not true. in the box it's only colored abc alphabets. there are no numbers and objects. misleading.

and the product does smell paint.",Manufacture misleading customers,0.236,0.701,0.063,-0.8842
2.0,2,2014-07-30,A136PLM5667QOX,B00000DMC6,"these are the only wooden block we could find in such a large size. i'm kind of disappointed in them. the paint is stamped on pretty messy, so on some the raised letter doesn't line up with the paint quite right. the paint easily chips off of the textured sides. also, several of the blocks have huge cracks in the wood that go down an entire side of the block, nearly cutting it in half. this makes them hard to stack and also makes me worry about splintering in the future. i would not buy these again or recommend them.",Kind of crummy,0.167,0.743,0.09,-0.7902
1.0,,2013-12-03,A2JROMDHVIUSKB,B00000DMC6,small little set not what i expected.  found a much nicer larger set at one of the big dollar chains.  a waste and not a good gift. looks cheap,Small,0.242,0.666,0.092,-0.5736
3.0,,2014-10-27,A52HKZAWZS3TX,B00000DMF5,the game is the classic version. but the quality is not great. the cards are printed very off center and some even have color where there shouldn't be color.,But the quality is not great. The cards are printed very off center and ...,0.137,0.863,0.0,-0.6642
3.0,3,2014-10-10,A1T0ML9RAOGFBQ,B00000DMF5,"i miss the old 1984 version. not sure why they added so many more characters. i also hate that it's not queen frostine but ""princess frostine"" and they made her all ""sexy"" looking.",Eh just okay. I miss the 1984 version I grew up with.,0.158,0.842,0.0,-0.5045
1.0,,2014-08-10,A15RLLBSFNO427,B00000DMF5,"the blatant sexualization of the female characters pictured inside the board, which are not shown in the pictures, is very disappointing. shame on me for not reading the reviews before the purchase.",Huge disappointment.,0.186,0.814,0.0,-0.7828
5.0,,2017-04-17,AWIMAC40K6SRU,B00000DMFM,who doesn't love operation?  absolute classic game!,Five Stars,0.379,0.621,0.0,-0.5661
3.0,,2014-03-30,A1UFMB4VWGFH6Q,B00000DMF5,"this game is nothing like the one i had when i was younger. the board, cards, and pieces are made cheap, the characters are all different than before and are just plain average looking, nothing exciting here.",Better Before,0.126,0.874,0.0,-0.5773
4.0,,2016-12-27,A1HV7TYF2VGFPS,B00000DMFM,"1 star because i want you parents to understand the game can actually hurt (no harm) the kids sensitive young nerves in the hands; but actually hurts.

let them know beforehand.  santa doesn't want to hurt for christmas",This may hurt a little...,0.272,0.67,0.058,-0.8898
3.0,,2018-01-03,A2EJQ9TQ8WBOQQ,B00000DMFD,"pieces do not work or fit together properly, which is the main point of the game play.... very disappointing for my children!! they don't make it like when i was a child!!",They don't make it like when I was a child,0.248,0.752,0.0,-0.8352
1.0,10,2013-06-28,A3C3LJEPEV98Y6,B00000DMF5,"i couldn't wait to buy candy land for my daughter.  i loved candy land when i was younger & i remember being jealous of the newer, cooler versions that came out after ""my time"".

i couldn't wait to open this box...but i was very disappointed when i opened the box.  the game board is too busy!  it's jam-packed with colors, characters, candy, scenery, etc.  it's hard to even see what's going on!  it's overwhelming.  & honestly, it's ugly!

we are considering buying a used version of this game that is not so ugly.  this board game is over-designed & poorly designed.

it's sad what has happened to this game...they should have left it well enough alone a few versions ago...",Too Busy!!!!!,0.16,0.769,0.071,-0.8852
1.0,,2017-11-18,A1ZWPNDFH86TT4,B00000DMFD,waste of money / difficult to put together/ direction in spanish/ put back in box didn't play/  cheap pieces,Waste of money / difficult to put together/ direction in ...,0.249,0.751,0.0,-0.6486
3.0,5,2013-01-23,A1YE4TXY3NXG7N,B00000DMF5,"i don't understand why companies try to fix things that aren't broken.  now the board is so ""busy"" it's annoying to look at, and it's not even cute.  there is a vintage version sold in a tin out there that i found after i purchased this one.  so this one is going to granny's house!!!",Old version soooo much nicer,0.113,0.841,0.046,-0.5811
1.0,,2017-01-06,A992SI2BGL8CQ,B00000DMFD,"ugh! this game is horrible. you have to rebuild the stupid thing every time you play, as you play.",This game is horrible. You have to rebuild the stupid thing EVERY ...,0.347,0.486,0.167,-0.7345
4.0,,2016-01-11,A1F3BXGWI0KXVU,B00000DMFM,"love the game. i bought this for my 6 year old girls. as a kid, i remember being excited/nerve wracked trying to avoid the loud obnoxious buzzer, it would almost startle you when it went off. this is partly why the game was so much fun! but the buzzer isn't the sameit sounds softer and less annoying. i miss the old buzzer!","Still a great game, but the buzzer has gone soft",0.158,0.767,0.075,-0.5254
1.0,,2016-12-26,A2E7KEFPOR91SV,B00000DMFD,game was broken and had many missing pieces. disappointed with this purchase!,Disappointed with this purchase,0.491,0.509,0.0,-0.8268
3.0,,2016-01-08,A2J6LVPWDFMIIZ,B00000DMFM,"classic version but a lot less noise than i remember (not necessary a bad thing)

pieces are much the same as i remember form 35 years or more ago. but small differences are not necessarily improvements.",Good game but not as I remember it.,0.193,0.807,0.0,-0.8016
2.0,2,2011-03-08,AGI13CNV0N6TN,B00000DMF5,"i played this as a child and loved the game. it was so much fun to look at the pictures because they were so tempting (from the 50's). sadly the game is cheaply made and the graphics are terrible and extremely ugly. i would pay more for a well made game and would much rather have the vintage graphics than these cheesy looking pictures. ugly, ugly, ugly!",Ugly Graphics and Made Cheaply,0.257,0.601,0.142,-0.8741
1.0,5,2016-08-03,A2AUEVQNRRLS7M,B00000DMFD,bought for my 5 year old grandson.  it's made much more cheaply than i remember from this game many years ago. it's very frustrating because parts fall down and the sequence very rarely works. don't waste your money.,"Poor quality, so game does not work.  Frustrating for both child and adult!",0.132,0.868,0.0,-0.6344
3.0,,2016-04-14,A32T81Y9BUGTVJ,B00000DMFD,"this game is a lot of fun; however..... it is a pain to set up.  my children are 5 and 8 and they cannot set it up.  it actually takes us (adults) a little while to get it right.  so, needless to say, if it does not stay set up then it is not played with. keeping it set up is a difficult task because it gets bumped while they are playing in the bedroom.  i gave it a lower rating because, for us, it was a complete waste of money.  i actually trashed it last week.",Hard for children to set up,0.131,0.817,0.052,-0.7741
1.0,2,2016-03-06,A21ZJMXYI6IBYM,B00000DMFD,"i remember the game when i was a kid. the game is still the same, however, made in china means cheap construction. the pieces do not fit well on the board. the board is way too small. as you turn the crank the plastic pieces move and pop out of their cardboard slots. the kids just construct the pieces and turn the crank to see the action ... they don't like to play the game because of the issues with the pieces issue.",they don't like to play the game because of the issues with ...,0.096,0.904,0.0,-0.7244
2.0,2,2008-06-29,A6HXFDIC7DVTC,B00000DMF5,"many adults don't like playing board games. why? because they think that all board games are more-or-less nothing more than sophisticated versions of candyland - games which rely on nothing more complicated than random chance.

the fact is that random chance doesn't make a very interesting game for adults (unless you're making bets, i suppose), and it doesn't make a very interesting game for children either if they're used to games with more strategy involved. (my young nieces, for example, *will* ask a lot for candyland - but only because i am not willing to play it with them very often.)

some people think that the lack of strategy makes these games easy for young children, and that's probably true, but it also makes it frustrating for them - they hit a losing streak and they have *no way* to turn it around, and they know that. i have never seen the same frustration with losing in games like sleeping queens or crazy eights that i have in candyland - and, tellingly, when my older niece loses crazy eights she pouts and then asks to play again. when she loses candyland, she pouts and puts the game away!

some chance is good in a game for kids - it levels the game. but i do not think a game that is entirely based on luck is a good idea.

instead of candyland, i'd reccommend a game with some level of skill involved - memory, or froggy boogie, perhaps.

there is no reason you and your kids have to be resigned to games of capricious fate.

edit: i've found out why my niece likes this game at all. it's not for any aspect of the game itself - it's because when she loses or wins due to chance, we have her ""draw a bedroom"" for herself, or for us. we started doing it because she got too frustrated and upset at losing through no fault of her own.",Highly overrated,0.191,0.713,0.096,-0.9847
2.0,7,2006-04-23,A8KYC9YS4F8BC,B00000DMF5,i was expecting much more fun game. my daughters are almost 4 and they get bored after 10 minutes :( it's so slow going and boring. i wouldn't recommend this game to anyone.,Boring,0.248,0.658,0.095,-0.5882
3.0,,2016-01-03,A3NB16PJEFPYVU,B00000DMFD,there are a few problems with getting all the parts to stand up correctly.  i had this game myself years ago.  too bad they haven't improved on the quality.,Too bad they haven't improved on the quality,0.267,0.733,0.0,-0.8296
1.0,,2015-08-20,A3RBFU6ZNHJPR6,B00000DMFD,i can't believe i spent money on this pos... the crank doesn't work and the boot has to be swung manually to make it kick the bucket (i had to bend the pole it's on to even get it to be close enough to kick it). it constantly fell apart each time we tried to add more pieces. i put this away after 1 day of frustration and my son hasn't asked to play with it since.,This game blows,0.067,0.933,0.0,-0.6293
1.0,,2015-06-18,A1Z8XJR7HESTTQ,B00000DMFD,very poorly made. pieces broke apart badly when trying to set it up. never got to play it because the pieces didn't fit together n it didn't work because of it.,Very poorly made. Pieces broke apart badly when trying ...,0.279,0.721,0.0,-0.842
1.0,7,2006-03-27,A3ILO637M9PLDP,B00000DMFM,"we purchased this game for our  granddaughter because our kids had it as children and spent hours of giggly fun operating on sam. we were so very disappointed with the quality of the game. it sure isn't what it used to be. the plastic ""organs"" and ""bones"" slip right off the tweezers when you try to remove them during the ""surgery"". they could have at least produced some kind of grip edge on them. also, the tweezers actually throw sparks when they touch the sides of the ""operative sites"". coupled with the loud buzz, our granddaughter perceived the was going to be shocked or hurt. even though we explained that she wouldn't be. she said, ""i don't like this game."" the game board itself is also very cheaply constructed. it's really a shame that they've ruined a game that was loads of fun in cutting costs by cheap manufacturing. sadly, this is another product manufactured outside the usa and it's become junk!",Operation -  Don't waste your money,0.124,0.816,0.06,-0.8926
1.0,2,2014-08-27,A1VWQ8T775NRIF,B00000DMFD,worst game ever invented for a parent.  setting it up and getting it to actually work is a nightmare.  my son and his friends do not care about playing the actual game.  just setting off the trap.  the game always ends in arguments and as a result needs a parent referee.,Worst game ever invented for a parent,0.232,0.714,0.054,-0.8489
1.0,10,2002-01-23,A1S7BFT0HDF3HA,B00000DMFM,"perhaps it was the nostalgia, perhaps the clever packaging. whatever compelled me to buy this game, i hope you do not fall prey to the same misguided intention.
my kids hate the game. they hate the buzzer, and they hate the tiny parts that get lost in the carpet. they hate the premise. there is no educational value in this game other than learning to count money or learning that specialists get paid exorbitant amounts of money, even more than ""regular"" doctors.
within minutes after we installed the batteries, the red light bulb that serves as a nose no longer worked.
i recommend you spend your money and time elsewhere.",This Operation Was not a Success,0.167,0.739,0.093,-0.8885
1.0,,2013-08-30,AKC8WWGF6OWVC,B00000DMFD,"if your kids are older and are really good at following the directions, maybe this could work. otherwise you will be struggling to put this together while your kids are freaking out impatient to get started. it ruined our christmas morning hassling with this game. very annoying.",set up is extremely frustrating,0.239,0.706,0.055,-0.8658
1.0,2,2005-07-24,A13XUPXF7QZ4ZB,B00000DMFD,"i hate this toy!!! it looks so much fun but hten, once you buy it, it breaks!!! the traps are broken and the board got scratched!!!!!!!!!!!!!!!!!!!!!!!!!!!!!!!!!!!!!!!!!!!!!!!!!!! i hate this toy!!!!!!!!!!!!!!!!!!!!!!!!! do not buy it!!!!!!!!!!!!!!!!!!!!!!!!!!!!!!!!!!!!",THIS IS THE WORST!!!!,0.296,0.651,0.053,-0.9087
5.0,,2018-01-02,A2OJDAHZ69MFRH,B00000GBX8,i got this for my son but all my kids try to steal it.,Five Stars,0.264,0.736,0.0,-0.6486
3.0,,2016-10-14,A2EF0MP8R8BOF3,B00000GBX8,weak glow effect.  unimpressive.,Weak glow effect,0.726,0.274,0.0,-0.6486
5.0,3,2016-02-25,A120F2J1X27K33,B00000GBX8,"kids love them but the dogs seem to think that they are some kind of death sphere and flee in terror when they expand.

warning: do not taunt hoberman mini sphere",Fun Toy,0.3,0.577,0.123,-0.8732
1.0,11,2009-09-04,A2I780LWDF42MP,B00000IRMM,i really wanted to like this. the screen is just so sub par. the kids will pull it out occasionally to use as a calculator but that's only because they don't have another one. however bad you think the screen might be it is probably worse. this quality of screen would have been complained about by reviewers 20 years ago because it does cut things off and make them unreadable. today it makes no sense to sell a screen like this when people are use to so much better. also a rubber button promptly fell off and is still floating around the house somewhere.,screen is a real problem,0.15,0.769,0.082,-0.8444
1.0,,2010-06-25,A1GFEOPOV6ALCR,B00000ISK4,i actually found these at home goods for [...]...well i am glad i did not pay more than [...]... first off the colors of the dolphins were all messed up..they didn't match their tubes...when i mean they didn't match...they put in whacky colors like red/orange colored dolphin but a yellow tube (no yellow dolphin) then we got two of the same colored dolphins.  okay..so the colors weren't a huge deal i suppose but then the dolphins wouldn't whistle...that's totally useless...and as someone else mentioned the links don't stay linked. huge disappointment!,Don't even bother,0.122,0.826,0.053,-0.8141
1.0,2,2016-10-14,A384ZVHNCLTWNK,B00000IT32,fun game but this set is terrible quality! cards are thin and some of ours were not printed on so we don't know which cards they are suppose to be and what we are missing. the directions have a ton of spelling errors too.,Fun game but this set is terrible quality,0.201,0.757,0.042,-0.8478
1.0,5,2016-08-22,A2X51NRR8NK5YC,B00000IT32,"ordered these thinking they were the genuine article, but they were clearly fakes.  multiple spelling errors in the directions.  cards were very poor quality (faded colors, random dots on the back, etc).  contacted amazon since i purchased them using amazon prime and was promptly issued a refund.  i used that money and went to walmart and bought the real thing for $1.50 less than i spent on these crappy cards.",NOT REAL,0.196,0.711,0.092,-0.8919
2.0,3,2005-09-02,A17VIBT0O9LTPO,B00000ISK4,we got these for our daughter becasue she loves bath time and playing her toy piano.  we figured this would be a cute toy that she would enjoy but we were wrong.  you have to beat the poor dolphins to get them to play a note.  and the note is more of an electronic sound...it's hard to describe it but it's not a musical note!  and it never fails after fianlly beating the things enough to get a sound out of them the ring comes loose.  it's just a total pain to use.  granted she still plays with them in the tub just we could have bought a cheap bag of plastic dolphins at the aquarium and saves 3/4 of the money we spent on this set.,Cute but doesn't really work,0.146,0.725,0.128,-0.768
1.0,,2005-06-28,A2R71O04OTFVEG,B00000ISK4,i was very disappointed with this toy.  when it was put in the tub the dolphins do not make sounds like they are suppose to.  the floats do not stay together and this makes my 20 mos. old very upset.  they look good and are cute but not worth the money.  would not recommend.,don't waste your money,0.172,0.763,0.065,-0.661
1.0,2,2016-07-27,ASV58505QOQU9,B00000IT32,this is obviously a fake.  the cards are not made of card material and it is impossible to shuffle them.  the edges of the cards are brittle and breaking right out of the package!  awful!!!  do not purchase.,Five Stars,0.172,0.828,0.0,-0.8057
2.0,7,2011-02-01,A5JLAU2ARJ0BO,B00000IRYQ,"the original rush hour is still much more fun.  the only reason i had to buy this is my son is such a train freak.  the puzzles are not as challenging overall, yet the difficulty level is a bit uneven in the four categories (junior, beginner, intermediate, advanced).  also, the build quality is poorer, as a few of the train pieces don't sit properly on the board, and the colors on the train pieces do not match those printed on the puzzle cards, a sore point for a young boy.","Not as fun as original Rush Hour, poor construction quality",0.124,0.814,0.062,-0.5928
5.0,,2016-01-01,A2DEWS53NAX5MO,B00000IT32,a classic! hard to go wrong here.,Five Stars,0.545,0.455,0.0,-0.5848
1.0,,2015-07-27,A6C1TL8ADZ06H,B00000IT32,"although they arrived before their time,  that seems to be the only thing i liked. all of the game instructions are in chinese, that won't help me out as i only read english..... what a scam....... what a joke, the garbage can is a good place to store them . the cards don't even look like what is on the box. i guess i should have read the reviews but i figured what could go wrong with a uno deck !!",The laugh is on me !!,0.101,0.829,0.07,-0.5374
1.0,,2014-12-25,A12TYSFI8B8BG0,B00000ISHM,"such a disappointment on christmas morning! when taken out of the package, the driver's side rear tire is broken and falling off. i wish it wasn't a christmas present so i could have opened it earlier when i ordered it. i will not be ordering again, as i fear the same thing might happen. we are very disappointed in this product and the waste of our money.",Broken in package.,0.241,0.722,0.037,-0.9323
1.0,3,2015-03-29,AKKXYLLFVCHGW,B00000IS7I,"absolute utter chinese crap.

remember when we were growing up and toys were built to last?  remember when a scientific toy actually taught scientific principals?

my kids have received numerous gifts under the name of scientific american over the years, and each one lasted under a day before it broke.
add the ""meteor rocket"" to that list.

this terribly manufactured toy takes an hour to build and 30 seconds to destroy.  if you are considering buying this for your little ones, know that they will need a sharp utility knife (not supplied), scissors (not supplied), tape (not supplied), a ruler (not supplied), baking soda (not supplied), vinegar (not supplied), and plenty of patients.

also not supplied is a discussion of the chemical reaction taking place that produces the gas.

once you manage to cut the balsa wood fins and attach them to the rocket, it's time to head out to a field and try this puppy out.

unfortunately, the pressurization system is as crappy as the materials.  it is a rubber stopper with a screw attachment that is supposed to keep the stopper in the mouth of the bottle.  the idea is that a tube stuck on the end of the stopper is supposed to keep the vinegar and baking soda from reacting while you tightening the stopper.

the reality is that it's really difficult to keep the rocket on its side while you carefully place the tube inside without spilling a single grain of soda.  if even a bit reacts, you will not be able to get the stopper to stay in.  the tightening mechanism does not work.

the only way we got a ""flight"" was to mix the chemicals and push the stopper in as hard as we could, allowing the rocket to launch while holding the stopper.  the result of course of a shirt covered with vinegar and baking soda.

and once the bottle opening becomes wet, it is impossible to create a good seal with the stopper.

a much better and virtually free chemical rocket can be found on the steve spangler website.  it uses things you have in your house to build the rocket.  the only thing you'll need to buy is a rubber stopper.  plus, the site actually talks about the reaction that's happening.",Scientific American has no pride,0.075,0.883,0.042,-0.9119
2.0,,2014-02-13,ANBFJNJRR4Q1F,B00000IS7I,"this product consisted of a plastic bottle, some ply-wood, some cellophane, and some silvery paper. the cellophane and paper were for ""decorating"" the bottle, but were very difficult to apply - and the directions didn't help at all. couldn't complete the job at one sitting because had to buy an x-acto knife first. so we ended up with an ugly looking plastic bottle. making it blast off was easy, just as we could have done with a plane plastic bottle. very disappointing.",Not what I expected,0.168,0.79,0.041,-0.9172
5.0,,2013-02-03,A2XQMOMWE46UZA,B00000IS7I,the little scientist is happy.  read the comment above.  n o no no no no non non no nono no,Happy child,0.478,0.398,0.124,-0.7759
2.0,,2015-10-12,A21YP1I9SS4B5P,B00000IU6Z,this was a disappointment because they do not fit tightly with each other. the slightest bump and it comes up from the opening.,This was a disappointment because they do not fit tightly with each other,0.213,0.787,0.0,-0.6608
2.0,2,2010-09-24,AY7GNA4VBNK7F,B00000IS7I,"this toy is a disappointment, the kit is overpriced for what it contains & the function of the rocket is terrible. building the kit went fine & is enjoyable (which is half the reason to buy kits such as these) & the theory of operation is sound. the problem we had with the rocket is the stopper pops out just as soon as you set it down thus there is no time for pressure to build and the thing just goes about 10 feet into the air. if i try to tighten the stopper it slips out of the bottle opening again & again. i'm going to try to roughen up the bottle opening & the rubber stopper (or try a different stopper) to see if we can get it to stay in place - if this works the rocket should fly much better.",Needs Improvement!,0.091,0.858,0.051,-0.7096
2.0,3,2009-08-01,A3E06BCCD0AU7B,B00000ISEH,"there are lots of positivie reviews about this toy, which you can refer to hear all the good things this toy has to offer. here are the i don't like about it:

1. it's makes noise that is appealing to children but very annoying to the adults in our family.
2. there is no place within the toy to store all the gears and pieces that come with it, so they end up easily separated and strewn around and lost easily.

update: this toy lasted two and a half months before the motor that turns the gears broke and the toy stopped working for good.",Not lasting fun,0.142,0.76,0.098,-0.6536
5.0,28,2013-11-20,A2798JNM3K3U4Q,B00000IS02,"it is a big loud drum i bought for my niece to exact revenge on my sister for years of crap.  i can't think of a better way to ""send my love""- i'll be buying a trumpet for her next birthday.",sweet revenge,0.203,0.797,0.0,-0.8129
2.0,,2018-04-09,A3AQN7QNLPN221,B00000ISC5,"so, i miss read it.  there are no caterpillars with this.  but, it is also not a kit.  it is the cage and a green thing with no instructions on what it is.","So, I miss read it. There are no ...",0.178,0.822,0.0,-0.5922
