overall,vote,reviewTime,reviewerID,asin,reviewText,summary,negative,neutral,positive,compound
3.0,,2014-11-21,AZBAZFSVLT1IV,B00000J0NT,"crayola packaged these poorly. they have them lying sideways in the box and when i received them, 8 crayon tips were broken off. i would've returned them if my daughter didn't want to just keep them so much. all crayons should be packaged upright.",Several broken tips,0.169,0.831,0.0,-0.7732
4.0,,2015-08-06,A2AJNLI3V5O27F,B00000J1E2,"this arrived,,, but was in the toy story packaging... not the retro packing as listed... :(",Four Stars,0.204,0.796,0.0,-0.5927
1.0,5,2007-02-20,AT94ICL01YHU0,B00000IZKX,"a torture device disguised as a toy. how would you like to spend all day playing on the stairwell? might as well go lick some dirty socks. i think my dog actually used to drag its bottom along the stairs to relieve a recurring rash. hey, ma, why does slinky go down but not up? who's the genius who found this at the scrapyard? most toys in the 1970s relied on mankind's perverse craving for repetition and/or irritation.",Why is this even being produced anymore?,0.205,0.721,0.074,-0.9098
5.0,,2014-01-10,AUOFDVOZV0JKA,B00000J0NT,"the only bad thing about crayons is they lose their sharp point so fast, and the sharpeners waste a lot of the crayon","Great variety of colors, none arrived broken",0.321,0.679,0.0,-0.8402
2.0,,2013-01-23,A272LERG5184RY,B00000J1E2,purchased as a christmas present for my 4 year old grandson.  very poor quality.  i think it will fall apart after a few uses.,Slinky Dog,0.152,0.848,0.0,-0.5256
1.0,2,2015-03-04,A2BUWQUCFCO198,B00000IZQX,"i would give this tricycle negative stars if i could, a whole load of them. my 21-month-old (who is well within the product's specified use range of 12 months through 5 years) managed to split her chin wide open falling off this toy a few days ago. she pushed forward with her feet at the same time as she leaned forward, causing the front wheels to slide right beneath her on the hardwood floor, because they have exactly zero traction. for a split second, she was up in the air vertically before she came crashing down, face-first, making contact with the floor with her chin. our trip to urgent care resulted not only in 4 stitches for her, but a mountain of anxiety and trauma for me, my husband, and our dear little girl. i simply cannot recommend strongly enough that parents stay away from this product. unless you have wall-to-wall carpet throughout your entire home, spend the extra money on something that is a little more durable and has more traction to prevent such a horrible accident from happening to your sweet little one.","Dangerous - Parents, please stay away from this product!",0.118,0.811,0.071,-0.8804
1.0,,2013-09-18,AFJW5GRL3LX8Z,B00000IZQP,"really disappointed. the picture is very misleading this picture the toy colour is much darker,looks more playful than the actual toy.
it is a rip off it doesn't worth the money.",Toy,0.216,0.698,0.086,-0.5939
2.0,,2015-03-16,A2GOYZ6MO0344,B00000IZOU,too light weight to pop on hard floor; you have to push down really hard to get it to pop. pops on carpet (because wheels only roll on carpet) but not great.,Pops on carpet (because wheels only roll on carpet) but not great.,0.191,0.809,0.0,-0.7042
2.0,,2014-03-05,ASY1Z0OKK4KO8,B00000IZQX,"we've had this for several month now, but my son doesn't ride this at all. i think he doesn't like the two wheels in front that there is no room for his legs to proceed. we wasted money on this trike.",not a good design,0.209,0.791,0.0,-0.8678
5.0,,2013-02-18,A1R1L2GL5Y1K6I,B00000IZQP,"el producto lleg&oacute; a tiempo, sin contratiempos, sin problemas el producto de muy buena calidad. la atenci&oacute;n del vendedor muy buena",Excelente,0.286,0.714,0.0,-0.802
3.0,,2013-01-08,A18PMN2VYJ73Z6,B00000IZQP,"the long pole in the middle worries us so we never put it in the playpen where baby stays most of the day. it has flaws. young baby may accidentally sits on top of the pole or sticks it into mouth or eyes.
not very safe.",Not very functional as stacking toy,0.152,0.814,0.035,-0.7204
1.0,,2012-12-29,A1NA4V36SJ2SM1,B00000IZQP,"this classic toy is overpriced here.  you can get it at any dept. store.
also this toy is not the best.  i have more trouble locating all the rings,
that the baby throws them around everywhere.  not the greatest toy.",overpriced toy,0.213,0.787,0.0,-0.8667
3.0,,2014-11-15,A32Q726D4KHNHH,B00000IZOU,"this is not the same type of ""popper"" toy that my kids had in the 70's!  this one has an annoyingly loud popper that grandparents can only stand for short periods of time.  it is also difficult for the little ones to push.  very disappointed in this toy.",Pops too loud!,0.119,0.881,0.0,-0.7339
2.0,,2014-11-06,ANOFUBRKDX0Y3,B00000IZOU,it does not work very well.  i even have trouble using this thing!,Not well made,0.334,0.666,0.0,-0.6153
5.0,,2016-12-27,AYGFGP8B3C40L,B00000IZKX,"it's a slinky folks!  no more no  less.  my son wanted one, and this is it.",It's a slinky ;-),0.265,0.735,0.0,-0.5707
1.0,2,2016-10-17,AVOSILTB1DNK5,B00000IZKX,"it's not kids friendly at all.
first, it's rather sharp that it damaged my wall.
second, it doesn't go down the stairs as the slinky is too rigid.
third, it was unusable after the boys played with it less than 24 hours.
sad.",Bad Slinky!,0.2,0.752,0.047,-0.7736
5.0,,2016-09-02,A2SWVHBL244VHD,B00000IZKX,who doesn't love a slinky?!! this works as it always has and is the metal one. i did buy this for my 2 year old daughter and she destroyed it within a couple months by twisting and turning it. probably better for 5 and up.,Love Slinky!,0.152,0.786,0.062,-0.643
3.0,,2016-04-27,A188J8XDPJOYRS,B00000IZKX,"although this slinky is marketed as ""original,"" i wonder if the style has been slightly changed. this model can only go down a stair or two at a time before stopping. perhaps it is just my (standard sized) staircase causing the problem. field tests may be in order...

should i find a set of stairs well-suited to this slinky, i'll re-evaluate my review.",Doesn't go down stairs!,0.071,0.929,0.0,-0.5106
1.0,8,2010-10-27,A1M8AYAL3L8ACP,B00000IZQP,"the dye from the blue ring comes off, and my baby had it all over her face!  i don't care if the company says it's non-toxic, i don't want my child ingesting this dye, and you shouldn't either!  why is this still on the market?",Do Not Buy This,0.098,0.902,0.0,-0.5321
5.0,,2017-12-25,A35WGF926T3XVC,B00000J0S3,arrived quickly with no problems.,Five Stars,0.62,0.38,0.0,-0.5994
1.0,5,2013-03-07,A2TOAJO74QWUNM,B00000IZEL,this is not the topple i played with 20 years ago. this game is now made to be cheap and is extremely flimsy. the pieces are so junky that they do not even stack above three. i was so disappointed. don't bother.,Junk,0.133,0.816,0.051,-0.5758
5.0,,2014-05-01,A1Y40TFYSTZPUN,B00000IZOU,"being a parent, i would rather not give this toy any star but from a child's perspective, it is a five star rating toy. the irritating popping sounds when you child walks with it in early morning is quite disturbing yet your child will never get enough of it. it has been used by my two kids and now i have given it to my nephew who enjoys it as much as my kids did and his parents are as irritated as i was :)",I don't love it but my child does,0.135,0.776,0.089,-0.664
4.0,,2016-02-23,A2JDL4P80JQH5X,B00000IZJB,hard to teach none rummy players.  i love it!,I love it!,0.458,0.542,0.0,-0.6199
5.0,,2008-08-31,A2B31JDSVV476K,B00000IZQP,"this is a classic toy that will be in use for months, if not years, for less than $10.  how can you go wrong?
my daughter still plays with this, and she's 2 and a half now.  we got it for her when she was about 6 months old -- she loved the colorful rings, especially the rattle one.  as she got older, she would practice putting the rings over the pole; she didn't care if they went on in the right order or not, she just enjoyed stacking them!  now, she tried to put them on in order, dumps them off, and does it all over again.",Classic Toy,0.099,0.85,0.051,-0.6728
5.0,,2014-09-21,A16KXFBJERRM8O,B00000IZKX,who doesn't love the slinky?,Five Stars,0.457,0.543,0.0,-0.5216
1.0,3,2013-07-17,A3KPWJ0BANN9RF,B00000IZKX,"this slinky is small/ too short. it does not ""walk down stairs"".  total waste of money.  i do not recommend buying it.",Not your original slinky,0.205,0.795,0.0,-0.6007
5.0,,2013-03-02,A6LHCT7P53RSA,B00000IZKX,who doesn't love the original slinky? i bought both of my kids one for christmas. they love them! they play with them all of the time!,An Old Favorite...,0.284,0.643,0.073,-0.7834
5.0,83,2005-01-09,A2H65VPSZO4P3M,B00000J01D,"i saw one of these murder mystery games at a bookstore, and thought they looked interesting.  this was my first murder mystery game i have ever hosted, and it was a blast!!!!  everyone come over dressed up in character, we had 50's music playing, and barbecue food.  all of the guests got into the parts more than i thought they would!!!  this was an extremely fun game, although i don't have any other mysteries to compare it to.  now we are planning to get together once a month for a murder mystery night!  this game was just a blast!

important:  even though this game says 6-8 players (there are 2 non-suspect parts), i would highly reccomend there only being 6 players.  the other two guests really had no part in any of the action.  they just sort of sat there and watched.  they aren't in any of the scripted parts, and people don't have replies to their questions.  it should only be for 6 players!!!",Best Party Ever,0.103,0.839,0.058,-0.8969
5.0,3,2015-10-01,A1AENLSOTD2NJ0,B00000J01D,great way to spend an evening with four couples and a little imagination! everyone enjoyed the dinner from the suggested menu and the scripts were very easy to follow! what a hoot! no one guessed the murderer but everyone had a suspect and made valid arguments. we have not laughed that hard in ages. can't wait to do another in the spring.,Cooked Up a Great Time!,0.203,0.685,0.111,-0.8288
2.0,3,2011-03-23,A1QDVPNND2FGLO,B00000IZKX,my son had a plastic slinky before this one. it didn't last very long. i got the metal one thinking that it would. i was mistaken. in a matter of weeks he had managed to get this so tangled up that we had to bin it. it was impossible to get it untangled. the toy has no apparent educational value and the novelty of watching it 'walk' wears off after a few times. i would not purchase another slinky no matter how he bargains!,Waste of money in my opinion.,0.086,0.859,0.055,-0.5562
2.0,3,2017-01-10,A3S6K4BHVXESFM,B00000J0S3,"they are all broken inside...

like, when i sharpen them, they just fall apart. the colored ""lead"" in them have all but shattered. no matter how much or how little i sharpen them, they just fall out when i try to use them after sharpening. they lasted about 15% of the length of the colored pencil before the leads started falling out.",Shattered Leads?,0.163,0.793,0.043,-0.8402
1.0,,2012-12-13,A25X0G3661F4D4,B00000IZOU,i would say buy this in the store so you can test it before buying it. i have to push down very hard to get it to pop at all. so it doesnt really work for the 1 year old it was purchased for. very upsetting,doesnt pop,0.11,0.89,0.0,-0.6232
4.0,,2013-02-14,A13DU428W7UDBI,B00000IZKY,"i don't remember purchasing this, but it's a slinky, what is not to love plus it comes in all kinds of colors",Ok,0.193,0.807,0.0,-0.6759
1.0,12,2012-07-30,A2KFSA6ZOPHAW,B00000IZOU,"i received this as a gift in july 2012.  the corn popper that is currently for sale is very poorly made.  the wheels do not roll, on either carpet or on hardwood.  i have a hard time making it pop when i am pushing it myself, exerting considerable downward force.

my one year-old daughter is a great walker but could never get this going.  she carries it around with her sometime, but i don't even think she understands what it is supposed to do.

additionally, the older models used to have a switch on the underside that could turn off the ""popping.""  this switch is gone.  when i called my mom to complain that ours didn't work, she told me to check to make sure it was in the ""on"" position.  when i let her know that no such switch existed she couldn't believe how much fisher price has cut corners to wreck a toy that used to be such a crowd-pleaser.

don't buy this unless you find an old used one at a tag sale.",Wheels don't roll,0.078,0.88,0.042,-0.743
5.0,2,2016-12-29,A2DW9SSCFZ5N9V,B00000J0S3,"we have been trying to get the kids to use these more, since they are so much more durable then crayons.  the first 2 packs were sadly messed up.  one was shorted around 6 pencils and the other had a broken pencil.  they quickly shipped me 2 more which arrived in perfect condition.  no complaints with the second set and will buy again in the future.",No complaints,0.181,0.768,0.051,-0.8176
4.0,,2014-09-16,A2S6O4ZQHQ21ND,B00000IZJB,just waiting for the long winters nights to pass the time...i hate winter...,Needs no batteries this is truly a corless device!,0.236,0.764,0.0,-0.5719
3.0,,2010-05-21,AGV44L5H5PGY9,B00000IZOU,"bought something for my daughter that i thought she might like but she doesn't touch the thing. i think its more of a boy toy then girl. but its a ok product, hell i had one when i was a kid.",Its ok,0.153,0.739,0.108,-0.5927
5.0,3,2005-02-09,A1ZCYIK3SLXA,B00000IZOU,"we got this for our son about 1 1/2 year ago.  when i vacuum, he brings this out and pretends to vacuum with me. it is very noisy so if there are parents out there that don't like toys that are too noisy, don't buy it!!!!",GOOD BUT NOISY,0.178,0.822,0.0,-0.7693
5.0,,2014-01-29,A2XGMYVQQYH6EH,B00000J0JF,"our family really enjoyed this game and we continue to play it, although i would say its one of those games that wouldn't be played for a very long time (years). the age rating says 8 and up but our 5 year old son has no trouble playing it, even including thinking of strategy to block other players etc. we modified the rules so instead of all players going for different cards without the other players knowing (per the instructions), we all try to get the same card so its more fun (in my opinion) because you can block each other (especially when our son blocks me or my wife and we pretend to be very upset by that :)",Great family game,0.165,0.726,0.109,-0.783
1.0,2,2017-04-11,A1I1QDVKPBOEEV,B00000J0JQ,"these arrived a few minutes ago.  the screens on both look dusty with particles showing up on the screen.  shaking them did not get rid of them or clean the screen.  these are defective, broken, crap and i just went to return them and they are not eligible for return.  imagine that?  take a crap defective product and give the buyer no recourse.  i bought two so i am out $25.00.  i bought these for a charity for impoverished kids who have no toys.  so, i can't give them a broken toy.  so, i will throw them out.  i am very angry.",Rip off  Do NOT buy.,0.241,0.709,0.049,-0.9606
1.0,3,2016-02-28,AP5GV4FTGJUD2,B00000J0S3,the lead in these pencils keep breaking.  i will never buy this brand again. i am really disappointed in these pencils. i sharpen them then they break. sharpen again...again...they break.,I am really disappointed in these pencils,0.115,0.885,0.0,-0.5256
4.0,,2015-11-10,ARCMNKD1S1H25,B00000J0S3,"i use these for adult coloring books and they work great, as long as you have a decent pencil sharpener.  but there's a weird lack of purple pencils.  there's orchid and violet, but no ""grape"" or ""lavender.""  just seems odd.  in any case, they work well.","... use these for adult coloring books and they work great, as long as you have a decent pencil ...",0.203,0.699,0.098,-0.6757
1.0,,2015-09-10,A1BDSD2ZQSDIHH,B00000J0S3,crayola! i'm ashamed of you! warped pencils and missing a color because i got two of one color. these will work fine for backgrounds but.........meh. i won't buy again.,Nope!,0.192,0.75,0.059,-0.6229
3.0,,2015-08-06,A3M1F7Y8MUUTGB,B00000J0S3,having problems with sharpening. leads keep breaking. real struggle,Great before sharpening,0.417,0.583,0.0,-0.6124
2.0,,2016-04-24,A3T26D2T0SS6A6,B00000J1DM,not what i thought it was..i was looking for the slinky part in the middle...my error when ordering..nothing wrong with the item..just not what i was looking for,not what i thought it was.. i was ...,0.195,0.805,0.0,-0.7003
5.0,,2016-11-21,A3FAGDHMCX4S4Q,B00000J0RJ,"all the colors were there, no damage, all new. exactly what you'd expect. my package was written in english though. i don't why the picture shows chinese?",Good!,0.184,0.816,0.0,-0.6597
4.0,,2013-02-19,A2XPWNKOVRWAE0,B00000J1DM,"problem not specific to slinky dog but to slinkies in general. i forgot how dangerous those metal edges look, they aren't sharp but not a great toy for unsupervised play. in two days my little one has already managed to deform the metal coils. also when pulled by the string slinky dog doesnt stay up on all four feet, it looks more like he is scratching his rear on the floor.",Cool toy but not necessarily for the little ones.,0.129,0.788,0.084,-0.5649
1.0,,2015-02-20,AZ1B51YA98UMV,B00000J0S3,"these break so much that we don't even get to use them, i got them for my daughter but as soon as we sharpen them thr lead breaks off before we even use it. very disappointing, that was all in the first week.",Breaks every time I try to sharpen them finally gave up,0.104,0.896,0.0,-0.6946
1.0,,2014-11-28,A8RKF82EMP6T1,B00000J0S3,the packaging was damaged with a big hole. the pencil box was crushed and instead of receiving 50 pencils i was 2 short. probably because they fell out. there was no interior wrap to prevent sliding all over.,The packaging was damaged with a big hole. The ...,0.197,0.775,0.028,-0.7783
5.0,,2016-10-11,A1RHCQGC5KP4CQ,B00000J4HK,"they hurt less to step on than giant legos.  my 20 month old loves these!  he clicks 4 or 5 together, builds a ""wand"" and tries to ""accio daddy"" (i may be a bad influence on him)",Excellent little set for little fingers!,0.176,0.734,0.09,-0.5411
1.0,2,2014-11-13,A1C0D6YUGZUJGI,B00000J0S3,"see edit below: i bought two boxes of crayola colored pencils. they are supposed to be sharpened, there were many that were not, and there were some that had broken leads in them. i am not sure if the other ones will have broken lead as well.

this was combined with a box of 120 crayola crayons which arrived with a number of tips broken off to the paper line. sad to have a box of brand new crayons that are broken before you get a chance to use them.

whether this is an issue from crayola, or from amazon, i am very disappointed. good product? bad shipping perhaps?...

edit: these have been used for a while now. about 1 in 4 pencils that are sharpened have broken lead in the wood. after sharpening them the lead wobbles in the wood. this is very disappointing. i am an artist. i am using a good sharpener. i hope the box i gave to my 5 year old granddaughter doesn't have the same problems. she will shed many tears and think she has done something wrong to cause the problem. what a bother. do not buy this product.",Broken lead.... al the way through the pencil,0.203,0.722,0.075,-0.9813
5.0,,2016-07-23,AZDPQFR7FOLRL,B00000J4HK,no more wood block frustration!!,he loved it,0.823,0.177,0.0,-0.8529
4.0,,2014-01-27,AZ39J99EWC9DL,B00000J0S3,your usual color pencils... my kindergardener used them for school work. one of the pink pencils was broken at the top which was very upsetting to him...,Good.,0.201,0.743,0.056,-0.6901
4.0,,2014-04-04,A3JJXTHUE9MJKB,B00000J4HK,"our son loves the outdoors, so it's tricky to find anything that holds his attention indoors.  this has been more successful than other attempts, but not amazing.  he loved the assorted stampers - 50 pc kids stamp assortment we purchased for him around the same time (as did his younger cousin).  they are two and 20 months.",They're alright,0.149,0.777,0.075,-0.7068
3.0,,2011-12-28,A2DIP0GDKE9HOB,B00000J4HK,"i apologize if this offends the purple lovers out there,  but i can't  stand purple, and was sad to receive our package today and discover that the base was purple. i bought this set in addition to the large building set, as that set only has one thick base board and my sons were fighting over it, so i can hardly complain of the toy itself, but i was annoyed to find that the package contents didn't match all the photos and box.",Sigh. Purple.,0.177,0.785,0.038,-0.9275
1.0,,2014-10-05,A3G4FZBUEPV1TM,B00000J4QK,"it is fragile, one piece broke right away. i wish i had kept the box and returned it. the kids don't really play with it, is not as good as other marble runs i have seen.",is not as good as other marble runs I have seen,0.19,0.741,0.069,-0.5802
1.0,,2013-11-14,A2RO70ATW4Q9RK,B00000J4XU,arrived with a botched paint job - sent back and didn't use. i've liked all of the haba items we have purchased other than this so it was disappointing.,faulty paint job,0.188,0.812,0.0,-0.6999
5.0,,2014-08-20,A3T9HIQTQ1NA55,B00000J58X,no complaints.  works!,Five Stars,0.839,0.161,0.0,-0.636
1.0,,2014-05-28,A3LPH1Q12SPHGR,B00000J58X,"ordered 2 of these for my kids systems- first, i thought they were chargers, which they are not. they are just power sources.  guess thats my fault for not paying better attention.  but secondly, they barely lasted a month before they just quit powering the systems altogether.  very disappointed.  so we are stuck just using batteries which the systems eat for breakfast. purchase these at your own risk. maybe you'll end up having better luck.",no. just no.,0.196,0.758,0.047,-0.8956
1.0,,2014-03-07,A3NK8GLEM7QPOM,B00000J58X,"this item does indeed work for the innotab 1, 2, and 3, and baby. the problem with the item is that it only lasts a few months. then it no longer powers the item it was bought for. it's perfectly useless, and you have to buy a new one. very poorly designed if you ask me. it's for a kids toy. one that would require alot of use. brand new name brand batteries only last less than 2 hours on these devices. so to buy one of these would be preferable if they worked for longer than a few months. buyer beware. (though there isn't a better product to recommend as i've found other adapters don't fit into the slot)",it works but..,0.097,0.85,0.053,-0.5448
1.0,,2013-07-14,A270R1LS9AA048,B00000J58X,"it didn't work on my grandson's vtech smile motion game. i haven't tried it on his other vtech toys, but very disappointed it doesn't work on the vtech motion game.",Didn't Work,0.138,0.81,0.052,-0.5913
2.0,,2013-05-18,A1G6XRYJ5D84KY,B00000J58X,"we got this ac adapter for my daughter's innotab because it goes through batteries like crazy! the ac adapter works great at first, but eventually stops working and we need to go get a replacement.  too bad for vtech, because they are spending more money on replacements of a junky product instead of making a decent product to begin with.  right now the thing looks brand new, no tears or damage, but no matter where in the house i plug it in, it will not power up the tablet.  i'd say this one lasted about 6 months.  i think they use cheep wires inside, where you can't see if they tear.  my almost-four-year-old loves using her tablet, especially to look at before she goes to sleep, but the tablet has an auto-shut-off feature, so i don't know what's damaging the adapter; we're using it normally. i think they just sell something low-quality.
don't spend too much money on this, and keep your receipt in case it quits on you.",Adapter for vtech tablet,0.114,0.81,0.076,-0.7807
2.0,,2013-03-03,AE4B5BTRBW0DK,B00000J58X,"obviously they work, but even with mild daily abuse they do not last long. we've gone through about 3 or 4 in the last year the kids have had the innotab...",Stock up on Them,0.172,0.828,0.0,-0.7783
3.0,,2013-01-02,A6VG60HYZTO3I,B00000J58X,i had to purchase this adapter for my son's innotab learning tablet.  while it is a good product this adapter should have been included with the innotab purchase!!  the tablet goes through batteries is no time!!  disappointed the adapter had to be purchased separately!!!,Adapter,0.134,0.806,0.06,-0.5526
1.0,,2012-11-25,A3UK2MU1AAM03O,B00000J58X,"i ordered this in august & am now realizing it only has a 30 day return policy.  my daughter has only been the one that has used this since my granddaughter is 4, so i know it has been handled carefully. it is now 2 months after i gave it to her & it has already quit working.  for the $30 i paid for this, i expected it to work longer than 2 months.  not only am i extremely disappointed in this product, i am upset that the seller only has a 30 day return policy.  i would not recommend this product nor the seller with their limited return policy.",product quit working after 2 months/only allows 30 days for return,0.098,0.888,0.015,-0.8178
5.0,,2011-10-04,A1X4V5ZE6LZBW0,B00000J58X,"after she killed a few sets of batteries.  i purcahsed this.  it was a must have for any parent, with childern that have the mobigo or v-reader.",A must have if you have a MobiGo/V-Reader,0.164,0.836,0.0,-0.6705
2.0,2,2017-03-24,APLCSN7K4VP1B,B00000J3LL,buttons are hard to open/close. zip is already broken. 2 stars because my daughter still loves it but i am really disappointed,Buttons are hard to open/close. Zip is already broken ...,0.299,0.611,0.09,-0.6694
2.0,,2015-01-12,A3CLHWWOVI9HMM,B00000J3LL,nice concept but smells bad and construction looks dubious. is this even washable?,Two Stars,0.402,0.503,0.095,-0.7964
2.0,,2016-11-10,A27BDJUVNUHGTB,B00000JB9N,not that happy with the product.  read the warning label before using.  it may make you think twice about using this product.  i did.,Not that happy with the product,0.204,0.796,0.0,-0.6595
