overall,vote,reviewTime,reviewerID,asin,reviewText,summary,negative,neutral,positive,compound
1.0,,2017-12-20,AIBSSERV4WLT0,B00004UBH3,"bought the 10 pack and it came with 8 bottles. missing the turquoise and the magenta  paint. i'm very disappointed, wish i could have given this no stars. the box also came open and damaged and i bought a brand new item. buyers be aware.",Missing bottles,0.22,0.72,0.06,-0.7914
3.0,3,2017-06-14,A1CVOZ5UIXB5W5,B00004UBH3,"the bottle design is what makes me get rid of these.

i like the color selection, the washable quality, no bad smell.  but the one problem i have with them is what makes me not want to buy them, - i put the remainder of my bottles in donation bin.  i got tired of trying to get the small amount of paint out of the bottle onto the paint tray.  there is no good way to squeeze a controlled amount out.  it just drops out as a big blob, or gets so dry in the bottle that you cannot get it out.  if you ever think it is great for kids -- give them a bottle, and they will drop the entire content onto the paper - and nothing then gets used.  what a waste!  someone out there could use them,  not me.","nice colors, but the bottle design is not for me and my kids",0.142,0.786,0.072,-0.8305
3.0,,2017-03-08,A23J3TL8QHREWA,B00004UBH3,"haven't used these to paint with yet, but they have a really overwhelming plastic smell still in the box. reminds me of my grandmas lotion haha, but kind of gross for paint. it's been a week and they still reek.  i'll update once we use them.",Smelly :(,0.17,0.757,0.074,-0.7343
5.0,,2017-01-29,A3REGXOG9QM1HH,B00004UBH3,"smell horrific, though!",Five Stars,0.701,0.299,0.0,-0.69
1.0,,2017-01-10,A22A7KD9050HK0,B00004UBH3,there was missing bottles! box was messed up. won't buy again,One Star,0.352,0.648,0.0,-0.5983
4.0,,2016-10-27,A2D0B4OROR70F0,B00004UBH3,"washed off baby really well, but him and i hated the smell of the paints. could only really paint a short period of time bc the smell is just soo stinky!","Great, but stink",0.252,0.702,0.046,-0.864
4.0,,2016-10-19,AWKVUDT16GKES,B00004UBH3,"holy moly, i've been through boxes of these.  crayola = washable = top ten mom must.  my only beef with these (vs. the squeezable tubes that simply don't come in as many colors) is that it's difficult to get the last bit of product out.  but with the price point and the fact that it's washable, who cares?  i will no doubt buy at least a dozen more boxes of these before my kids are old enough to stop painting with "" kid paint.""",Paint Too Proud to Beg,0.119,0.82,0.061,-0.6369
4.0,,2016-09-17,A3POAS8GAK41F9,B00004UBH3,"it has some unpleasant smell,  not sure if it's really non-toxic!",Four Stars,0.373,0.627,0.0,-0.6546
1.0,,2016-08-14,A23R9SZOAXI7ZE,B00004UBH3,"i must have a bad batch. according to th reviews, these wash off of everything. ummmm, no. my daughter has ruined two shirts and a pair of pants after paint got on them. we even took them off promptly, and soaked hen in oxy clean. still stained.",I must have a bad batch. According to th reviews,0.171,0.777,0.052,-0.7269
5.0,,2015-03-17,A2ODC9OXXI8UG0,B00004UBH3,"as advertised, no complaints",As advertised,0.71,0.29,0.0,-0.5994
3.0,,2013-10-29,A1NXPMNBH7ZNEA,B00004UBH3,would have given this product a 5 star but only received 9 bottles of paint in the box. the green paint was missing from the carton. they had to mix two colors to get a green color of paint. very disappointed in packaging.,washable kids paint bottles,0.166,0.834,0.0,-0.8121
2.0,,2013-08-09,A3JV3V5DL6F3GA,B00004UBH3,"i received the package as expected but the crayola packaging was worn out and broken so the paint fell out as soon as i opened the shipping packaging.  upon opening the paint bottles, none of them had a seal (not sure if this is normal) and the lids have smears, as if it's been poured before.  with this suspicion, most of the paint were, at most, 75% capacity, being the blue color with the least at half contents of the bottle.  out of all the colors, the yellow seemed full but when poured out, it was a thin liquid unlike the other colors that it spilled out half of the bottle.  my kids used the paint nevertheless since we had already the set up all the materials to paint but i was not happy with the purchase.",Crayola Washable Kids Paint set of 10 Bottles,0.103,0.876,0.02,-0.9185
2.0,,2013-06-07,A1JU5XS3F68WV,B00004UBH3,"the green bottle of paint had already been opened before i received this item, and it was all over the outside of the other bottles. it was too much trouble to complain about, so i did not return them. i will not order them again online.",Opened Before I Received Them,0.113,0.887,0.0,-0.6369
2.0,,2014-02-04,A1MVYVGYPRLQ7N,B00004UE4S,"i was really disappointed with this. it comes it a basic and flimsy plastic container, the items described on the outside cover of the container were not the items in the container. the items in it were mini size and the ""projects"" given to make we're boring very very boring and with the mini size items supplied it made it difficult to make the boring items. the price your paying for this makes it a bigger rip off.",A Let Down,0.155,0.845,0.0,-0.8955
1.0,128,2012-12-27,AXP95N0X7KNNZ,B00004UE4S,"i am not one to write reviews, but my disappointment in this product is overwhelming. i purchased this for my very crafty 5 year old son for christmas. after reading the reviews i was expecting quite a variety of crayola products inside, what we received was exactly the opposite. the following is what we received. my son was coloring in the notebook before i realized the lack of contents inside the box, if not for it being used, i would be returning this for a refund.

steralite container with a blue cover.
small color wonder 15 page coloring book
25 page note pad
8 crayons
child scissors
glue stick
8 fat markers.
8 color wonder markers
2 glitter sticks.",DISAPPOINTMENT,0.066,0.934,0.0,-0.8126
3.0,,2003-03-18,A2JCGJMT4VI9MA,B00004UD79,"i bought this right after my daughter was born. it is nice b/c it has a hoop that you can attach it to stroller/ car seat, etc., but my kids did not like it. i kept it but they rarely played w it. it gets wet when they chew it & all in all i didn't care for it.",A beautiful toy but my kid hated it,0.145,0.823,0.032,-0.7757
5.0,,2016-12-22,A11KHPF2OFDBY6,B00004UE4F,no problem,Five Stars,1.0,0.0,0.0,-0.5994
4.0,,2016-12-14,A32OFNMAOE7JEP,B00004UE4F,"arrived slightly damaged, but the kids don't really care",Four Stars,0.443,0.557,0.0,-0.6778
5.0,,2015-09-28,A3EQ9RVRUN71A6,B00004UFOO,what isn't to love about crayole?,Five Stars,0.402,0.598,0.0,-0.5216
4.0,,2014-07-08,A1XVK708LXA7IW,B00004UE4F,markers and blank paper.  pretty basic.  only writes on the paper but there is a slight lag before the line appears. when i was drawing i caught myself pushing down harder than necessary because of the delay.  i'm guessing the babies won't do that.,They work!,0.131,0.823,0.046,-0.6059
5.0,,2013-12-22,A101K1Y5BQJBFZ,B00004UE4F,"my daughter started using this paper, along with the color wonder markers, around 18 months. it is a fun activity for a cheap price. plus, there's no mess! the only negative is that the use of this paper is only one sided.",For all ages.,0.181,0.75,0.069,-0.6588
2.0,2,2015-05-21,A2A37E8ZMUBLWM,B00004UFOO,"my main issue with these are that almost all of the marker tips were deteriorated in some way from the time we opened them. issues include; clumpy ink (?) tips, tips that looked like a toddler already pushed them back into the plastic casing, or tips that had pilly fuzzy threads that made the markers write horribly. my 4 year old doesn't mind it, but i think they are terrible.",Marker tips already deteriorated when package opened,0.088,0.888,0.024,-0.6808
4.0,,2014-11-11,A22PYCE9Y0OWK6,B00004UFOO,"the only thing bad i have to say about this product is that, the case is terrible. the markers can slip out on each side and, you can't close the tab to get the markers which means a mess if you drop the whole thing. i should have bought a container to put them in. i would not take this to travel with unless you don't mind having markers splatter everywhere in your car. the page and, the package of the markers don't tell you all of the sented ones.i had to find out which ones were. it's the ones that are at the end of the first row. the ends of markers are black instead of white. i also did not receive  an instruction sheet like as described on the bottom page describing the product. the markers don't work well with coloring pages. it bleeds through and it can tear the page

sented markers

black - vanilla
dark brown - vanilla
light brown vanilla
blue - blueberry
turquoise - blueberry
dark green - kiwi?
green -apple
dark orange - tangerine?
yellow - lemmon
orange - orange
dark red- cherry
red- cherry","The case is junk and, not good for using while traveling.",0.071,0.916,0.013,-0.8712
4.0,,2010-12-31,A3GSOY08RDP0UN,B00004VX2C,"after reading lots of reviews about baby purses, i decided on the gund. it's very soft and plush, which my daughter enjoyed in her first purse. what was disappointing was the phone. it's cell phone ringer died after my daughter played with it two times. she still likes to hold the phone to her ear but gets upset when she pushes it and no sound comes out.",Nice purse but...,0.141,0.783,0.076,-0.705
2.0,,2017-01-08,A2Y68BUZJEX7K9,B00004W3Y5,these were not like i expected them to be. they were quite disappointing. by the time i saw how my son did not like them it was too late to return them for we had used them.  my son doesn't like art and these did not help in the matter... the fine motor skill is so forced and not what i wanted,These were not like I expected them to be,0.229,0.746,0.026,-0.9209
1.0,,2018-05-03,A2QE01Y7D5KB3F,B00004W3Y4,"horrible product,not only did the top/dabber tear very quickly, the washable part, not so much..contacted their customer service and have not heard anything","Not durable, Not so washable",0.137,0.863,0.0,-0.5423
2.0,2,2012-09-25,A4TJUA6UJWHNU,B00004W3Y5,"my 2 yr old loved stamping with these, but when he was done we started to clean up and he had ink stains left all over his hands, he is not a big fan of dirty hands, so he was not pleased.",not washable,0.187,0.694,0.119,-0.5271
1.0,,2016-02-02,A1KQ21SERWU1JK,B00004W3Y4,"these leak, and dry out almost as soon as they arrive. would not recommend. should have asked for a refund, but not worth the effort.",No Thanks,0.2,0.8,0.0,-0.503
5.0,,2015-01-10,AE6U3JBGQDQML,B00004W3Y4,no mess!,Five Stars,1.0,0.0,0.0,-0.6114
1.0,7,2012-07-06,A1V401AEEMLKVY,B00004W3Y4,"maybe i didn't read properly, i will check the description.  don't buy these for toddlers because they are 100% not washable off hands...what a disaster :-(","great concept, NOT WASHABLE! YIKES!!",0.239,0.761,0.0,-0.765
1.0,,2018-02-01,A3NWXE7PIWTPG6,B00004W61C,"we have 3 dogs & they all hate this.  it's fairly quite, but some of the sandpaper was already falling off the disks when we received it new.  my husband glued them back together without much trouble, but it scares all the dogs & they won't have anything to do with it.  2 of them are shih tzu's & 1 is a lab & her nails are so thick that it would take forever even if she would let you near her with this grinder.  the worst thing is that i have looked everywhere for replacement disks and have found none anywhere.","It sounds like a good idea, but our 3 dogs hate it. Can't buy replacement disks.",0.125,0.847,0.028,-0.8783
5.0,,2017-09-13,A1IG90M800U97Z,B00004W61C,"this toy is totally a blast!  you should take the advice in the instructions and have some kind of remote handy nearby. the occasional fail mechanism is that it sticks to the ceiling. it's funny if you're an adult, but it's totally unbearable for the kids! ha! they freak out and think the toy will get stuck there forever. (note: do not fly it outside though!)",Totally a blast!,0.131,0.802,0.067,-0.6925
2.0,,2017-06-28,A369JX2ZYJQV0Z,B00004W61C,i would be giving a better review if not after a month of using it the color already starts to fade it's like it's been in the sun for months on end it's still holding together for now but i'm not very happy that the colors faded so bad,I would be giving a better review if not after a month of using it ...,0.185,0.72,0.095,-0.8465
2.0,,2014-12-24,A2O3GLW7K6PW48,B00004W60H,"this game has the most awful graphics, my kids didn't care for it at all, especially since most of the picture cards to memorize were either too difficult or really boring and old fashioned looking. this game needs a 21st century makeover.",Gathering dust,0.229,0.771,0.0,-0.8754
5.0,2,2015-04-28,A1IC7LGNOTDK47,B00004W61C,"i am pretty unhappy with this purchase, but it was mainly my fault.

i viewed on a forum that this would work with the esc that comes in a mini 8ight. it will not. i have it hooked up and it works perfectly with my castle sidewinder, but it won't work for the losi unfortunately. i originally bought this so that i could dial the esc down to 50% throttle or less, but it turns out i needed the losi brand cable.

that being said - it works very well for my castle setup. i ended up buying her a cheap castle setup to go in the mini 8ight anyway, it wasn't worth it to buy another cable and worry about all that mess.",I am pretty unhappy with this purchase,0.133,0.784,0.083,-0.6868
5.0,,2015-03-21,A36GB998A8IZ6B,B00004W61C,no problems.,Five Stars,1.0,0.0,0.0,-0.5994
4.0,,2015-02-15,A6JD1IONQGP2G,B00004W61C,"kinda useless unless you are going to jump deep into the setting. the only setting i have changed is the battery mode and played with a few others. if you do buy this i highly recommend buying the castle y connector at least for those using a waterproof receiver. if i would have known the ""field card"" does the exact same i would have gotten that instead.

a massive negative for the card or maybe castle is the lack of clear color marking on the esc and card. it is a 50-50 shot of it working the first time, but when you get it wrong you get a red light and that is all, no damage to anything.","Does what it is suppposed to, very excessive for what I needed it to do.",0.14,0.815,0.044,-0.9119
5.0,,2014-01-04,A1G44CSFS5AF6B,B00004WHO4,these are sturdy and just plain rad. my kid is digging em and my fridge is a t rex war zone.,3 year old loves,0.178,0.822,0.0,-0.5994
5.0,,2012-02-10,A1F2FKOF9IMNVF,B00004WKT8,"when our daughter was having difficulties learning about telling time, we started by drawing circles.  we realize it was time consuming and inefficient.
so we search, and search until we found the big yellow clock.  after couple of days our daughter got the hang of it.  it is a low tech tool that made a tremendous impact in our daughter learning how time works.",Time learning made simple,0.067,0.933,0.0,-0.5106
5.0,2,2017-03-13,A29HBL2VVSIB3P,B00004WKR7,"these magnets are big enough (except for the i) for young kids!  they do not fit in the mouth, so no swallowing hazard!",Great for kids 1-2 years old!,0.209,0.791,0.0,-0.6768
1.0,,2015-05-19,AHJHFYOYI8EC,B00004WKR7,these are useless - they just barely hold their own weight on a vertical surface. forget about actually using them as magnets!,Save your money,0.217,0.783,0.0,-0.6114
3.0,4,2016-03-04,A2X1MRXFEGGB9Y,B00004WKR8,"we have the rubabu magnetic capital letters on the fridge and i decided my daughter needed some lower case letters, too.  (the rubabu lower case ones aren't magnetic unfortunately.)  after spending entirely too much time researching magnetic letters i wound up with these.  they're okay and large enough for little hands.  my biggest issue is that the magnets are so small that they aren't as good as they could be.  our 'f', for instance, won't stay upright and turns sideways.  when you get magnetic letters, especially from such a reputable brand, you expect that the key component--aka the magnet--would work properly.",The magnets--a key component of MAGNETIC LETTERS--could be better,0.066,0.915,0.018,-0.6002
3.0,,2015-06-19,A3VKNAZ6WO0PV3,B00004WKR8,"it is ok only, not very strong enough to stick on my refrigator . now it is everywhere on the floor and dangerous to have them in hte kitchen.","it is ok only, not very strong enough to ...",0.181,0.753,0.066,-0.5885
4.0,18,2009-04-13,AK0CENM3LUM28,B00004WKU2,"learning resources stethoscope / b00004wku2

when my heart starting skipping beats unexpectedly due, apparently, to chronic stress, i decided i needed a stethoscope on hand for quick assessments of my heart beat during my palpitation periods. amazon is my standby in these emergencies and, among the expensive ""med student"" options, there was this learning resources toy. the results, in my opinion, are mixed.

first, this is not the most sensitive of stethoscopes. the heart beat is softer than more expensive stethoscopes, probably to lessen potential damage to a child's eardrums if the stethoscope is mishandled. (seriously, that would be a huge concern of mine before handing this toy over to a child. hearing loss is permanent and should not be flirted with.) the stethoscope realistically picks up every errant movement or flutter of clothing, so the user must hold very, very still in order to get a decent read on the already soft-sounding heart rate.

second, as others have noted, the hearing pieces on this stethoscope hurt. i can't leave the stethoscope in my ears for more than a minute or so. the hearing pieces are fairly big (i'd estimate larger than a small child's ear could comfortably accommodate, but i can't say with certainty), very hard, and press inwards strongly, and at an uncomfortable angle. attempts to ""stretch"" the metal out a bit have failed so far.

bottom line, though, is that this stethoscope does work for what i purchased it for, even if it doesn't work as well or as painlessly as i'd like. i can monitor my heart during periods of bad heart activity, although i dislike that the stethoscope is too painful to use for frequent ""spot checks"". i can't imagine that this would be a particularly sturdy toy - if i have to keep the chewy rubber away from inquisitive cats, i'd have to think that small teeth could so just as much, if not more, damage. although i suppose the majority of children don't chew on their toys past age 5, a younger brother or sister could wreak a goodly amount of havoc on this toy.

~ ana mardoll","Not Quite a Toy, Not Quite a Medical Device",0.113,0.834,0.053,-0.9796
4.0,,2009-02-22,ASRBYINM4S7ZA,B00004WKU2,"this stethoscope was just right for my 5yo's birthday.  real enough to work, but not so real that her ears could be damaged by misuse.",Just what the doctor ordered.,0.138,0.862,0.0,-0.5927
1.0,3,2016-08-21,A1W6O6UYCDLGZ,B00004WKU2,very uncomfortable to put in ears and doesn't work at all. plus the end kept falling off and eventually wouldnt even glue on again. and we had less than 6 mths,Dont bother,0.138,0.862,0.0,-0.5413
5.0,2,2015-06-07,A2X34ARP02NTV,B00004WKU2,"this is an excellent stethoscope. i saw other reviewers talking about how the ear pieces hurt and were uncomfortable, but myself and my 4-year-old did not have this problem at all.

i've also seen other stethoscopes that say they play a prerecorded heartbeat when you put it up to anything, even inanimate objects like a table, but i tested this one and got nothing from things that weren't alive, and actually heard my son and i's real heartbeats.

the stethoscope is well made, but sadly my 4-year-old has been on a destructive streak lately, and he damaged it beyond repair so we had to get rid of it. still, this is not due to bad product design.

when my son gets older and learns to respect his toys instead of destroying things, i may consider getting him another one. for now though, i won't reward his bad behavior.",Great Stethoscope with Real Heartbeat,0.182,0.691,0.127,-0.897
1.0,,2015-03-10,A36WZ3BAXXPM8S,B00004WKU2,"it works and it was really cool at first, my son loved it but the circular part that you use to listen with detaches and falls off constantly, my son has gotten so frustrated he won't even bother playing with it now. disappointing",falls apart,0.218,0.66,0.121,-0.8145
4.0,,2012-12-29,A26HTPPUD3X1ZS,B00004WKVI,"overall, this is a nice set. i do have an issue with the pancakes. they look nothing like pancakes. they're an orange/brown color and are oddly shaped. the muffin is a lot smaller than i figured it would be and the bacon looks kind of like uncooked bacon or some kind of fake bacon.",Breakfast Foods,0.135,0.815,0.05,-0.5877
1.0,,2014-09-01,ASQKCOMX3JFJA,B00004WKU2,hurts my ears!,One Star,0.629,0.371,0.0,-0.5255
1.0,2,2016-11-18,A180I4IDQ47YQZ,B00004YO15,ugh! crayons broken and box corners torn as though used. new? i don't think so.,One Star,0.427,0.573,0.0,-0.8016
5.0,,2016-10-02,A3S8P20F52HP78,B00004YO15,box holds all crayons without collapsing. great choice of colors and a great start for oreschoolers,Great start for preschoolers. Every color they could want. Plus sharpener in back of box,0.322,0.586,0.092,-0.6908
1.0,,2016-08-24,A3IAHEX7F6OUA3,B00004YO15,"when i opened the package, every crayon had fallen out of the box. the box and crayons were covered in crayon marks. some of the crayons were broken.",damaged and broken,0.183,0.817,0.0,-0.6808
1.0,,2016-08-24,A1OGUSVDTTWLS9,B00004YO15,poor box of 64 crayons. surprised at quality. 2 were broken. top lid had crayon writing underneath lid from sliding around in box. seemed as though had been sitting on shelf a long time. poor packaging. not the usual new crayons that one expects.,Wouldn't purchase unless I received a one off box?,0.186,0.74,0.074,-0.765
4.0,,2016-05-25,A2GY9HMAZP1ORJ,B00004YO15,came in with quite a bit broken pieces,Need to improve...,0.36,0.64,0.0,-0.5233
5.0,,2016-04-21,A30A3386OZ0X9G,B00004YO15,what's not to love?  it's crayola.,Five Stars,0.402,0.598,0.0,-0.5216
5.0,,2016-03-31,A337NTS6HYOX5U,B00004YO15,who doesnt love crayons!,Five Stars,0.55,0.45,0.0,-0.5661
5.0,,2016-02-24,ABMOVY1HQKKY6,B00004YO15,crayons.. as expected.. nothing fancy.. and perfect!,and perfect!,0.354,0.646,0.0,-0.509
5.0,,2015-08-18,A8OES05K3K1UQ,B00004YO15,as bad as it sounds these are for my husband...he loves to color with our kids but hates using theres bc the break the tips off...and i hate spending 10.00 on a pack of crayons...so this price was amazing and lots of coloring is going to be happening,as bad as it sounds these are for my husband,0.187,0.687,0.126,-0.5574
5.0,,2015-07-15,A3GHCFZ5DM4E8M,B00004YO15,i'm so excited to have my own set of crayons. i'm not going to share with my destructive 3 year old! muhahah!,Mine....all mine...,0.238,0.663,0.099,-0.583
5.0,,2015-03-21,A3MIRWCCZ07ZZB,B00004YO15,"these crayons are great.  don't buy roseart or any other cheapo brand.  these crayons are full of color not all waxy, i mean they actually allow children to color without having to push on them until they break like other crayons.  but i hate crayon boxes.  the box they come in sucks, the sharpener is not worth it, save yourself the headache and buy a plastic pencil box to put them in before your kids (or husband) tries to open this flimsy cardboard box...it will rip and the crayons will be everywhere, homeless crayons.",These crayons are GREAT. Don't buy Roseart or any other cheapo brand,0.133,0.812,0.056,-0.8747
5.0,,2015-03-10,AML6RDRVB0Z8,B00004YO15,"it's crayola what's not to love, a little cheaper than any store and shipped right to the house, can't beat it.","It's crayola what's not to love, a little cheaper than any store and shipped ...",0.151,0.849,0.0,-0.5216
5.0,,2015-02-21,A3RS8Z8RYMS36J,B00004YO15,who doesn't love a new big box of crayons?,Five Stars,0.325,0.675,0.0,-0.5216
1.0,,2018-02-28,A1VVLWPDUVLBX6,B00004YO0Y,this toy broke about an hour after it was opened.  it literally just stopped working.  we tried changing the batteries but that didn't fix it.  very disappointed.  my older son had a game like this when he was younger and it lasted for years.  i'm really beginning to believe toys aren't made as good as they used to be.  this toy turned out to be a piece of junk very quickly.,Broke within an hour,0.141,0.817,0.042,-0.7782
5.0,,2015-01-15,A25BPX9DYA7SAI,B00004YO15,who doesn't love crayola crayons?,Five Stars,0.457,0.543,0.0,-0.5216
3.0,,2014-12-15,A1PQ5KKPEFGE8S,B00004YO15,"they came in a padded envelope and some were broken, all were scattered out of box which was crushed. silly to buy crayons over internet, lesson learned!",crappy shipping experience,0.204,0.759,0.036,-0.7263
5.0,,2014-12-08,A119ZRP5ZH6T6P,B00004YO15,"why 5 stars, because this is just how i remembered it... back in elementary school.  very cool cardboard box, that still has the crayon sharpener in the back.  for the price you pay (for me, $3.34, currently $2.89), it's a steal!

a few crayons had their tips broken off, so you may want to buy an extra pack or two... or few... it doesn't matter, since my kids end up breaking them in a matter of minutes/hours.",PERFECT,0.128,0.82,0.052,-0.6102
1.0,,2018-02-11,AU20PARJ6KOT2,B00004YO0Y,only worked for like 5 minutes before it got jammed. there was no sign of anything getting stuck so i guess its just defective one.,Jammed on first play,0.248,0.664,0.087,-0.5574
4.0,,2018-01-18,A2F5C8UEQXC9V6,B00004YO0Y,"i thought i had ordered the one with two speeds, but this one only has one speed.  it was frustrating for my 2 1/2 year old great-granddaughter for the first couple of games...then she just turned the switch off and played...lol",Cute game...,0.094,0.906,0.0,-0.5927
3.0,,2018-01-17,AF7YG40VDE4YO,B00004YO0Y,"quality is terrible. one fish broke on first use. it's not made with magnets like i remember, now the teeth catch the hook things. the poles are cheap and the hooks are not on stings anymore just plastic rods. eh.",Quality is terrible. One fish broke on first use,0.133,0.811,0.056,-0.5267
